{
  "schemaVersion": "wabench.v1",
  "suiteId": "wabench.public.core",
  "version": "v1.0.0",
  "name": "WritingAgentBench Public Core v1",
  "description": "A privacy-safe synthetic writing-agent evaluation set derived from two legacy evaluation systems, deduplicated and rewritten to remove product-specific and time-sensitive details.",
  "partition": "public_holdout",
  "visibility": "public",
  "caseRefs": [
    "wacore_001",
    "wacore_002",
    "wacore_003",
    "wacore_004",
    "wacore_005",
    "wacore_006",
    "wacore_007",
    "wacore_008",
    "wacore_009",
    "wacore_010",
    "wacore_011",
    "wacore_012",
    "wacore_013",
    "wacore_014",
    "wacore_015",
    "wacore_016",
    "wacore_017",
    "wacore_018",
    "wacore_019",
    "wacore_020",
    "wacore_021",
    "wacore_022",
    "wacore_023",
    "wacore_024",
    "wacore_025",
    "wacore_026",
    "wacore_027",
    "wacore_028",
    "wacore_029",
    "wacore_030",
    "wacore_031",
    "wacore_032",
    "wacore_033",
    "wacore_034",
    "wacore_035",
    "wacore_036",
    "wacore_037",
    "wacore_038",
    "wacore_039",
    "wacore_040",
    "wacore_041",
    "wacore_042",
    "wacore_043",
    "wacore_044",
    "wacore_045",
    "wacore_046",
    "wacore_047",
    "wacore_048",
    "wacore_049",
    "wacore_050",
    "wacore_051",
    "wacore_052",
    "wacore_053",
    "wacore_054",
    "wacore_055",
    "wacore_056",
    "wacore_057",
    "wacore_058",
    "wacore_059",
    "wacore_060",
    "wacore_061",
    "wacore_062",
    "wacore_063",
    "wacore_064",
    "wacore_065",
    "wacore_066",
    "wacore_067",
    "wacore_068",
    "wacore_069",
    "wacore_070",
    "wacore_071",
    "wacore_072"
  ],
  "coverage": {
    "taskTypes": [
      "abnormal",
      "dedupe",
      "polish",
      "topic",
      "writing"
    ],
    "capabilities": [
      "clarification_or_degrade",
      "constraint_following",
      "deduplication",
      "long_form_writing",
      "safe_handling",
      "source_grounding",
      "style_control",
      "topic_ideation",
      "transformation_fidelity"
    ],
    "riskTags": [
      "fact.fabricated_key_detail",
      "interaction.adversarial",
      "interaction.guardrail_missing",
      "source.boundary",
      "transformation.meaning_changed"
    ]
  },
  "privacy": {
    "allowsRawText": true,
    "publicationPolicy": "full"
  },
  "createdAt": "2026-08-19T00:00:00.000Z"
}
